{
  "schema": "https://identity-atoms.com/schemas/atom-v1.json",
  "type": "auth-method",
  "id": "ssh-key",
  "version": "1.0.0",
  "name": "SSH Public Key",
  "description": "Asymmetric key authentication for SSH connections. Requires the private key to sign a challenge from the server.",
  "algorithm": "ed25519-or-rsa",
  "trust_level": "signed",
  "issuer": "local-keyring",
  "tags": ["ssh", "public-key", "asymmetric", "ed25519", "rsa", "authentication"]
}
