{
  "schema": "https://identity-atoms.com/schemas/atom-v1.json",
  "type": "auth-method",
  "id": "saml2",
  "version": "1.0.0",
  "name": "SAML 2.0",
  "description": "XML-based standard for exchanging authentication and authorization data between identity providers and service providers. Enterprise SSO.",
  "algorithm": "saml2",
  "trust_level": "signed",
  "issuer": "(SAML IdP)",
  "tags": ["saml", "saml2", "sso", "enterprise", "authentication", "xml"]
}
